example,Left context,Center,Right context,Title,Author,Header,created,Sphere,Type,Full context
долгий,специальной высокоскоростной железной дороги был опять,отложен,"в долгий ящик, но ОАО РЖД","Их не догонят // Коммерсант, 26.05.2010",NA,Их не догонят,2010,NA,статья,"По накатанной колее   «Сапсан» изначально планировали собирать в России, но поезд так и остался исключительно немецким  Фото: Александр Коряков, Коммерсантъ  Проект специальной высокоскоростной железной дороги был опять отложен в долгий ящик, но ОАО РЖД начало ряд проектов по скоростному движению на существующих путях."
долгий,"нищем Дагестане развитие вместо новых боев,",отложен,"в долгий ящик, пишет корреспондент Саймон","Ольга Радько. Взвешенный подход к борьбе с инсургентским движением в России отложен // Новый регион 2, 16.04.2010",Ольга Радько,Взвешенный подход к борьбе с инсургентским движением в России отложен,2010,NA,комментарий,"Более взвешенный подход к борьбе с инсургентским движением в России, обещавший обеспечить в нищем Дагестане развитие вместо новых боев, отложен в долгий ящик, пишет корреспондент Саймон Шустер в статье, опубликованной в Time."
долгий,проблема реструктуризации убыточных производств вновь будет,отложена,"вдолгий ящик, аэти увольнения","Зайниев Антон. 350 тысяч россиян останутся без работы до начала майских праздников // Труд-7, 07.04.2010",Зайниев Антон,350 тысяч россиян останутся без работы до начала майских праздников,2010,NA,комментарий,"Втаком случае проблема реструктуризации убыточных производств вновь будет отложена вдолгий ящик, аэти увольнения проявятся уже через полгода-год."
долгий,"опасение участников рынка, что проект вновь",отложат,в долгий ящик.,"Анна Ануфриева. Полиграфисты получили обещанное // РБК Daily, 01.03.2010",Анна Ануфриева,Полиграфисты получили обещанное,2010,NA,комментарий,"Это усилило опасение участников рынка, что проект вновь отложат в долгий ящик."
долгий,для размещения на подлодках) «Синева» или,отложенного,в долгий ящик проекта «Барк» (твердотопливной,"Дарья Неклюдова. Испытания «Булавы» отложены // Новый регион 2, 15.12.2009",Дарья Неклюдова,Испытания «Булавы» отложены,2009,NA,неопределенная категория,"В последнее время эксперты заговорили о возможном отказе от «Булавы» в пользу ее жидкостного конкурента БРПЛ (баллистической ракеты, предназначенной для размещения на подлодках) «Синева» или отложенного в долгий ящик проекта «Барк» (твердотопливной баллистической ракеты, предназначенной для размещения на подлодках)."
долгий,"Водолеи, кое-какие задания,",отложенные,"вдолгий ящик, перешли вразряд","Прогноз астролога Павла Глобы // Труд-7, 01.12.2009",NA,Прогноз астролога Павла Глобы,2009,NA,гороскоп,"Водолеи, кое-какие задания, отложенные вдолгий ящик, перешли вразряд срочных итребуют вмешательства."
долгий,"актуален», поэтому его одобрение не будет",отложено,в долгий ящик.,"Елена Фомина. Трансфертные цены приравняют к рыночным // РБК Daily, 02.11.2009",Елена Фомина,Трансфертные цены приравняют к рыночным,2009,NA,комментарий,"Документ, по мнению источника, «очень актуален», поэтому его одобрение не будет отложено в долгий ящик."
долгий,не стоит на повестке дня и,отложен,"в"" долгий ящик "",―серьезных препятствий для","Алексей Фаезов. Новый генсек НАТО: об Афганистане, России и расширении альянса // РИА Новости, 03.08.2009",Алексей Фаезов,"Новый генсек НАТО: об Афганистане, России и расширении альянса",2009,NA,отчет,"А после того, как Расмуссен заявил о том, что вопрос вступления в НАТО Грузии и Украины фактически не стоит на повестке дня и отложен в"" долгий ящик "",―серьезных препятствий для развития отношений альянса с Россией нет"",―сказал он."
долгий,кризиса финансирования проект БЭМО может быть,отложен,в долгий ящик.,"Леонид Хомерики. Товарищи по достройке // РБК Daily, 27.01.2009",Леонид Хомерики,Товарищи по достройке,2009,NA,комментарий,"Таким образом, по словам г-на Сосновского, в условиях кризиса финансирования проект БЭМО может быть отложен в долгий ящик."
долгий,"решения, идеи и предложения, пришедшие сегодня,",отложите,в долгий ящик.,"Глоба Павел. 22 СЕНТЯБРЯ // Труд-7, 22.09.2008",Глоба Павел,22 СЕНТЯБРЯ,2008,NA,гороскоп,"Весы, решения, идеи и предложения, пришедшие сегодня, отложите в долгий ящик."
долгий,Дело будет,отложено,"в долгий ящик, потому что это","Екатерина Поспелова. Рынок растет // РБК Daily, 12.09.2008",Екатерина Поспелова,Рынок растет,2008,NA,комментарий,"Дело будет отложено в долгий ящик, потому что это играет сильно против Минфина», – отметил г-н Наумов."
долгий,провал грузинского блицкрига в Южной Осетии,отложил,в долгий ящик планы военного решения,"Гагик Багдасарян. Есть ли потепление между Анкарой и Ереваном? // РИА Новости, 09.09.2008",Гагик Багдасарян,Есть ли потепление между Анкарой и Ереваном?,2008,NA,статья,"Хотя многие армянские аналитики считают, что провал грузинского блицкрига в Южной Осетии отложил в долгий ящик планы военного решения карабахского конфликта, тем не менее, ни у кого нет гарантий, что Азербайджан полностью отказался от силового решения проблемы."
долгий,"угла собственные интересы, а пожелания заказчиков",отложите,"в долгий ящик, то из фрилансера","Петухов Никита. ЛЕГКО ЛИ РАБОТАТЬ НА СЕБЯ // Труд-7, 01.08.2008",Петухов Никита,ЛЕГКО ЛИ РАБОТАТЬ НА СЕБЯ,2008,NA,статья,"Но если вы поставите во главу угла собственные интересы, а пожелания заказчиков отложите в долгий ящик, то из фрилансера быстро превратитесь в обычного безработного."
долгий,"Правда, их вариант",отложен,в долгий ящик.,"Шевченко Алексей. В ЕВРОПЕ НАЧАЛАСЬ АРШАВИНОМАНИЯ // Труд-7, 23.06.2008",Шевченко Алексей,В ЕВРОПЕ НАЧАЛАСЬ АРШАВИНОМАНИЯ,2008,NA,комментарий,"Правда, их вариант отложен в долгий ящик."
долгий,"По слухам, его просьбы пока",отложены,в долгий ящик.,"Чубайс может стать сенатором от Свердловской области в Совете Федерации! – Самые крутые слухи недели // Новый регион 2, 23.06.2008",NA,Чубайс может стать сенатором от Свердловской области в Совете Федерации! – Самые крутые слухи недели,2008,NA,неопределенная категория,"По слухам, его просьбы пока отложены в долгий ящик."
долгий,Этот проект,отложен,в долгий ящик?,"«На телерынке инвестиции —  далеко не решающий фактор» // Коммерсант, 06.06.2008",NA,«На телерынке инвестиции —  далеко не решающий фактор»,2008,NA,интервью,Этот проект отложен в долгий ящик?
долгий,после смены власти в Киеве была,отложена,"в долгий ящик"".","Консорциум во имя «Газового мира» // РИА Новости, 22.02.2008",NA,Консорциум во имя «Газового мира»,2008,NA,статья,"Эта идея обсуждалась давно, однако, после смены власти в Киеве была отложена ""в долгий ящик""."
долгий,Южная Африка недавно,отложила,в долгий ящик запланированное производство биотоплива,"Перевод Татьяны Глазковой. Биотопливо вредит климату // РБК Daily, 14.02.2008",Перевод Татьяны Глазковой,Биотопливо вредит климату,2008,NA,заметка,"Южная Африка недавно отложила в долгий ящик запланированное производство биотоплива из кукурузы, поскольку этот злак является основным продуктом питания в первую очередь для бедных семей."
долгий,"Сейчас, когда лигочемпионские амбиции обеих команд",отложены,"в долгий ящик, ""Локо"" не без","Юрий Дудь. Локомотив» снова сошел с рельсов // Известия, 24.12.2007",Юрий Дудь,Локомотив» снова сошел с рельсов,2007,NA,неопределенная категория,"Сейчас, когда лигочемпионские амбиции обеих команд отложены в долгий ящик, ""Локо"" не без труда пробивается в групповой турнир Кубка УЕФА, а каталонцы кошмарно стартуют в национальном первенстве."
долгий,"партнерстве и сотрудничестве (СПС), который был",отложен,в долгий ящик из-за конфликта Москвы,"В Португалии проходит «самый странный» саммит Россия – ЕС // Новый регион 2, 26.10.2007",NA,В Португалии проходит «самый странный» саммит Россия – ЕС,2007,NA,неопределенная категория,"Не заводят уже речь дипломаты и о заключении взамен истекающему в 2007 году нового соглашения ЕС и РФ о партнерстве и сотрудничестве (СПС), который был отложен в долгий ящик из-за конфликта Москвы с Польшей и странами Балтии, пишет newsru.com."
долгий,"собрание в виде законопроекта, может быть",отложена,в долгий ящик.,"Асфальтовое гетто // Коммерсант, 13.10.2007",NA,Асфальтовое гетто,2007,NA,статья,"Горожане раскритиковали правительственную программу поквартальной реконструкции хрущевок  Программа реконструкции домов первых массовых серий, одобренная в середине сентября городским правительством и внесенная вчера в Законодательное собрание в виде законопроекта, может быть отложена в долгий ящик."
долгий,нужны (хотя неужели идея силового звена,отложена,в долгий ящик?).,"обозреватель «Советского спорта» Юрий Цыбанев. Буровая установка Быкова. Чем удивила сборная России на Ходынке // Советский спорт, 18.12.2006",обозреватель «Советского спорта» Юрий Цыбанев,Буровая установка Быкова. Чем удивила сборная России на Ходынке,2006,NA,комментарий,"Грубо говоря, яркие тройки Быкову пока особо и не нужны (хотя неужели идея силового звена отложена в долгий ящик?)."
долгий,"помогла Партии регионов победить на выборах,",отложен,в долгий ящик.,"Украина впадает в кризис // РБК Daily, 15.12.2006",NA,Украина впадает в кризис,2006,NA,неопределенная категория,"Референдум по НАТО, идея которого помогла Партии регионов победить на выборах, отложен в долгий ящик."
долгий,"стратегией России, считая, что это вновь",отложит,в долгий ящик процесс расширения КТК.,"Вайнштоку отдали КТК // РБК Daily, 04.12.2006",NA,Вайнштоку отдали КТК,2006,NA,комментарий,"Иностранные акционеры КТК недовольны такой стратегией России, считая, что это вновь отложит в долгий ящик процесс расширения КТК."
долгий,в южную Европу―Южно-Европейский газопровод―будет,отложен,в долгий ящик.,"«Газпром» примеряет Nabucco // РБК Daily, 05.10.2006",NA,«Газпром» примеряет Nabucco,2006,NA,комментарий,"Впрочем, это не означает, что альтернативный проект по доставке газа в южную Европу―Южно-Европейский газопровод―будет отложен в долгий ящик."
долгий,"с Ковыктинским месторождением, разработку которого придется",отложить,"в долгий ящик»,―отмечает он.","«Газпрому» мало нефти // РБК Daily, 29.09.2006",NA,«Газпрому» мало нефти,2006,NA,комментарий,"В первую очередь это связано с Ковыктинским месторождением, разработку которого придется отложить в долгий ящик»,―отмечает он."
долгий,"вопрос не решится, он вновь будет",отложен,в долгий ящик.,"Татьяна Фроловская. Россия откажется от обязательств перед торговыми партнерами // РБК Daily, 05.07.2006",Татьяна Фроловская,Россия откажется от обязательств перед торговыми партнерами,2006,NA,статья,"Ведь если до саммита вопрос не решится, он вновь будет отложен в долгий ящик."
долгий,"еще в 2001 году, снова будет",отложено,в долгий ящик.,"Алексеев Владимир. ЗВОНОК ДЛЯ «МЕГАФОНА» // Труд-7, 31.05.2006",Алексеев Владимир,ЗВОНОК ДЛЯ «МЕГАФОНА»,2006,NA,комментарий,"Зато совершенно понятно, что первичное размещение акций на международных торговых площадках―IPOС, запланированное акционерами ""Мегафона"" еще в 2001 году, снова будет отложено в долгий ящик."
долгий,"исключено, что документ МЭРТа может быть",отложен,"в долгий ящик, а разработкой кластерной","Россия перешла в подготовительный кластер // Коммерсант, 24.03.2006",NA,Россия перешла в подготовительный кластер,2006,NA,статья,"Но, как стало известно Ъ, не исключено, что документ МЭРТа может быть отложен в долгий ящик, а разработкой кластерной стратегии займется Госсовет РФ."
долгий,Проблема палестинских беженцев,отложена,в долгий ящик.,"Сегодня проходят выборы в парламент Палестины // Новый регион 2, 25.01.2006",NA,Сегодня проходят выборы в парламент Палестины,2006,NA,информационное сообщение,Проблема палестинских беженцев отложена в долгий ящик.
долгий,на рынок оказывают макроэкономические новости: правительство,отложило,в долгий ящик идею радикального снижения,"Осторожно: электронная почта // Ведомости, 2005.03.15",NA,Осторожно: электронная почта,2005,NA,комментарий,"Понижательное давление на рынок оказывают макроэкономические новости: правительство отложило в долгий ящик идею радикального снижения ставки НДС, а инициатива предпринимателей об отмене импортной пошлины на оборудование и снижении ставки ЕСН не нашла поддержки в Бюджетной комиссии”, – отмечает Павел Ворожцов, аналитик ИК “Русские финансовые традиции”."
долгий,программ в сфере здравоохранения не будет,отложена,"в долгий ящик, она начнется со","Приоритетом в здравоохранении станет первичная медицина // Vesti.ru, 27.09.2005",NA,Приоритетом в здравоохранении станет первичная медицина,2005,NA,комментарий,"Путин отметил, что ""реализация программ в сфере здравоохранения не будет отложена в долгий ящик, она начнется со следующего года""."
долгий,партии Шредера на выборах СЕГ будет,отложен,в долгий ящик.,"Колчанов Рудольф. ЕВРОПЕЙСКИЙ МАРШРУТ // Труд-7, 09.09.2005",Колчанов Рудольф,ЕВРОПЕЙСКИЙ МАРШРУТ,2005,NA,статья,"Ряд польских политиков надеется, что проект в случае проигрыша партии Шредера на выборах СЕГ будет отложен в долгий ящик."
долгий,назначении главы свердловского исполкома «Единой России»,отложено,"в «долгий ящик», до лучших времен.","Итоговый выпуск (вечерний) – 28.06.05 18:30 – Екатеринбург // Новый регион 2, 29.06.2005",NA,Итоговый выпуск (вечерний) – 28.06.05 18:30 – Екатеринбург,2005,NA,неопределенная категория,"Поэтому решение о назначении главы свердловского исполкома «Единой России» отложено в «долгий ящик», до лучших времен."
долгий,обычно ответных вариантов два: пообещать и,отложить,в долгий ящик или терпеливо убеждать,"Шевелев Владимир. БРАК ПО РАСЧЕТУ // Труд-7, 20.05.2005",Шевелев Владимир,БРАК ПО РАСЧЕТУ,2005,NA,неопределенная категория,"У ""большого брата"" обычно ответных вариантов два: пообещать и отложить в долгий ящик или терпеливо убеждать ""малыша"" умерить аппетиты."
долгий,и среднего бизнеса снова могут быть,отложены,"в ""долгий ящик"".","Российская экономика: мысли о будущем // Известия, 27.04.2005",NA,Российская экономика: мысли о будущем,2005,NA,статья,"А это значит, что инициативы по развитию малого и среднего бизнеса снова могут быть отложены в ""долгий ящик""."
долгий,Однако в дальнейшем проект был,отложен,"в «долгий ящик», а «Сургутнефтегаз» стал","Дмитрий Коптюбенко. «Сургутнефтегаз» разбивает копилку // РБК Daily, 26.11.2004",Дмитрий Коптюбенко,«Сургутнефтегаз» разбивает копилку,2004,NA,заметка,"Однако в дальнейшем проект был отложен в «долгий ящик», а «Сургутнефтегаз» стал проявлять интерес к белорусским активам в этой отрасли, в частности, к предприятиям «Полимир» и «Нафтан», которые готовились к приватизации."
долгий,―,Отложили,в долгий ящик.,"Пресс-дайджест по государствам СНГ и Балтии за четверг, 15 апреля // РИА Новости, 15.04.2004",NA,"Пресс-дайджест по государствам СНГ и Балтии за четверг, 15 апреля",2004,NA,неопределенная категория,Отложили в долгий ящик.
